{"average_field_lengths":{"authorityDocs":0,"body":147.5,"codePath":15.25,"codeSymbol":3.25,"codeTest":3.5,"description":24.5,"hooks":42.25,"name":7.25,"scopes":2,"triggers":27},"document_count":4,"document_ids":["ci_latency_lock_needs_machine_scaling","lockfile_must_pin_canonical_registry","npm_publish_requires_2fa_and_ci_provenance","offline_e2e_requires_fixture_owned_npm_cache"],"field_names":["name","hooks","description","triggers","codePath","codeSymbol","codeTest","authorityDocs","scopes","body"],"idf_table":[1.2039728043259361,0.6931471805599453,0.10536051565782635,0.3566749439387324],"schema":"ownmem-index.postings/v2","terms":[{"idf":0,"postings":[[2,[[3,1],[9,1]]]],"term":"0.1.0"},{"idf":0,"postings":[[2,[[9,1]]]],"term":"0.1.1"},{"idf":0,"postings":[[2,[[9,1]]]],"term":"08"},{"idf":0,"postings":[[2,[[9,1]]]],"term":"16"},{"idf":0,"postings":[[0,[[9,1]]]],"term":"2-core"},{"idf":0,"postings":[[2,[[9,1]]]],"term":"2026"},{"idf":0,"postings":[[2,[[9,1]]]],"term":"2026-08-16"},{"idf":0,"postings":[[2,[[0,1],[1,1],[3,1],[4,1]]]],"term":"2fa"},{"idf":0,"postings":[[0,[[9,1]]]],"term":"2x"},{"idf":0,"postings":[[0,[[9,1]]]],"term":"38"},{"idf":0,"postings":[[2,[[3,1]]]],"term":"403"},{"idf":0,"postings":[[0,[[9,1]]]],"term":"6.72"},{"idf":0,"postings":[[0,[[9,1]]]],"term":"72"},{"idf":0,"postings":[[0,[[1,2],[2,1],[9,1]]]],"term":"absolute"},{"idf":0,"postings":[[0,[[9,1]]]],"term":"abstention"},{"idf":0,"postings":[[2,[[3,1],[9,1]]]],"term":"access"},{"idf":0,"postings":[[2,[[9,1]]]],"term":"account"},{"idf":0,"postings":[[2,[[1,2],[2,1],[9,1]]]],"term":"actions"},{"idf":0,"postings":[[2,[[9,1]]]],"term":"after"},{"idf":1,"postings":[[2,[[9,1]]],[3,[[9,2]]]],"term":"against"},{"idf":0,"postings":[[0,[[9,1]]]],"term":"algorithmic"},{"idf":0,"postings":[[0,[[9,1]]]],"term":"all"},{"idf":0,"postings":[[0,[[9,1]]]],"term":"allowance"},{"idf":0,"postings":[[0,[[2,1]]]],"term":"alone"},{"idf":2,"postings":[[0,[[9,1]]],[1,[[3,1],[9,1]]],[2,[[9,1]]],[3,[[9,1]]]],"term":"an"},{"idf":2,"postings":[[0,[[9,5]]],[1,[[9,1]]],[2,[[0,1],[1,1],[2,1],[4,1],[9,4]]],[3,[[2,2],[9,2]]]],"term":"and"},{"idf":0,"postings":[[2,[[9,1]]]],"term":"announcing"},{"idf":3,"postings":[[0,[[9,1]]],[2,[[9,1]]],[3,[[9,2]]]],"term":"any"},{"idf":0,"postings":[[0,[[9,1]]]],"term":"are"},{"idf":1,"postings":[[1,[[9,1]]],[3,[[1,2],[9,2]]]],"term":"as"},{"idf":0,"postings":[[3,[[9,1]]]],"term":"assertion"},{"idf":0,"postings":[[3,[[9,1]]]],"term":"asserts"},{"idf":3,"postings":[[0,[[9,1]]],[1,[[2,1]]],[3,[[9,1]]]],"term":"at"},{"idf":0,"postings":[[2,[[9,1]]]],"term":"attestation"},{"idf":0,"postings":[[2,[[3,1]]]],"term":"authentication"},{"idf":0,"postings":[[3,[[3,1]]]],"term":"available"},{"idf":0,"postings":[[0,[[9,1]]]],"term":"barely"},{"idf":0,"postings":[[2,[[2,1],[9,1]]]],"term":"be"},{"idf":1,"postings":[[0,[[9,1]]],[1,[[9,1]]]],"term":"because"},{"idf":0,"postings":[[0,[[9,1]]]],"term":"becomes"},{"idf":1,"postings":[[0,[[9,1]]],[2,[[9,2]]]],"term":"before"},{"idf":0,"postings":[[0,[[4,1],[8,1]]]],"term":"benchmark"},{"idf":0,"postings":[[0,[[4,1]]]],"term":"benchmarks"},{"idf":0,"postings":[[0,[[4,1]]]],"term":"benchmarks/public-benchmark.mjs"},{"idf":0,"postings":[[0,[[9,1]]]],"term":"beyond"},{"idf":0,"postings":[[0,[[9,1]]]],"term":"blowup"},{"idf":0,"postings":[[2,[[9,2]]]],"term":"both"},{"idf":0,"postings":[[0,[[1,2],[3,1],[9,2]]]],"term":"budget"},{"idf":0,"postings":[[0,[[2,1],[9,1]]]],"term":"budgets"},{"idf":0,"postings":[[1,[[2,1],[9,1]]]],"term":"build"},{"idf":0,"postings":[[3,[[9,1]]]],"term":"bundled"},{"idf":0,"postings":[[3,[[9,1]]]],"term":"bundled-layout"},{"idf":1,"postings":[[0,[[3,1]]],[3,[[3,2],[9,1]]]],"term":"but"},{"idf":0,"postings":[[0,[[1,2],[2,1]]]],"term":"by"},{"idf":0,"postings":[[2,[[2,1],[3,1],[9,1]]]],"term":"bypass"},{"idf":0,"postings":[[2,[[2,1]]]],"term":"bypass-enabled"},{"idf":0,"postings":[[1,[[9,1]]]],"term":"byte"},{"idf":0,"postings":[[1,[[9,1]]]],"term":"byte-identical"},{"idf":0,"postings":[[3,[[0,1],[1,5],[2,2],[3,1],[4,1],[9,6]]]],"term":"cache"},{"idf":0,"postings":[[3,[[3,2],[9,1]]]],"term":"cached"},{"idf":0,"postings":[[0,[[3,1],[5,1],[9,1]]]],"term":"calibrate"},{"idf":0,"postings":[[0,[[9,1]]]],"term":"calibrated"},{"idf":0,"postings":[[2,[[2,1],[9,1]]]],"term":"can"},{"idf":0,"postings":[[3,[[2,1],[9,1]]]],"term":"cannot"},{"idf":0,"postings":[[1,[[0,1],[1,1],[4,1],[9,1]]]],"term":"canonical"},{"idf":0,"postings":[[0,[[9,1]]]],"term":"catch"},{"idf":0,"postings":[[0,[[9,1]]]],"term":"certify"},{"idf":0,"postings":[[1,[[9,2]]]],"term":"change"},{"idf":0,"postings":[[1,[[9,1]]]],"term":"check"},{"idf":0,"postings":[[1,[[9,1]]]],"term":"chose"},{"idf":2,"postings":[[0,[[0,1],[1,3],[2,1],[4,1],[8,1],[9,2]]],[1,[[3,1],[9,1]]],[2,[[0,1],[1,1],[4,1],[9,2]]],[3,[[3,1],[8,1],[9,3]]]],"term":"ci"},{"idf":0,"postings":[[2,[[9,1]]]],"term":"ci-side"},{"idf":0,"postings":[[0,[[0,1]]]],"term":"ci_latency_lock_needs_machine_scaling"},{"idf":0,"postings":[[0,[[1,1],[4,1]]]],"term":"ci_latency_lock_needs_machine_scaling.md"},{"idf":0,"postings":[[3,[[1,2],[5,1],[9,1]]]],"term":"cli"},{"idf":0,"postings":[[3,[[2,1],[9,1]]]],"term":"cmd"},{"idf":0,"postings":[[1,[[3,1]]]],"term":"com"},{"idf":0,"postings":[[0,[[9,1]]]],"term":"complexity"},{"idf":1,"postings":[[2,[[9,1]]],[3,[[9,1]]]],"term":"config"},{"idf":0,"postings":[[1,[[2,1],[9,1]]]],"term":"configuration"},{"idf":0,"postings":[[1,[[9,1]]]],"term":"configured"},{"idf":0,"postings":[[2,[[9,1]]]],"term":"configuring"},{"idf":1,"postings":[[1,[[9,1]]],[3,[[9,1]]]],"term":"consumer"},{"idf":0,"postings":[[1,[[1,2]]]],"term":"consumers"},{"idf":0,"postings":[[3,[[9,1]]]],"term":"controls"},{"idf":0,"postings":[[0,[[9,1]]]],"term":"core"},{"idf":0,"postings":[[0,[[9,1]]]],"term":"counts"},{"idf":0,"postings":[[0,[[9,1]]]],"term":"cpu"},{"idf":0,"postings":[[2,[[9,1]]]],"term":"dance"},{"idf":0,"postings":[[1,[[9,1]]]],"term":"defect"},{"idf":0,"postings":[[3,[[9,1]]]],"term":"deliberately"},{"idf":0,"postings":[[3,[[9,1]]]],"term":"dependencies"},{"idf":1,"postings":[[1,[[9,1]]],[3,[[9,1]]]],"term":"dependency"},{"idf":0,"postings":[[0,[[9,1]]]],"term":"determinism"},{"idf":0,"postings":[[3,[[2,1],[9,1]]]],"term":"developer"},{"idf":0,"postings":[[3,[[9,1]]]],"term":"died"},{"idf":0,"postings":[[0,[[9,1]]]],"term":"directly"},{"idf":0,"postings":[[3,[[9,1]]]],"term":"directory"},{"idf":0,"postings":[[2,[[9,1]]]],"term":"dist"},{"idf":0,"postings":[[2,[[9,1]]]],"term":"dist.integrity"},{"idf":0,"postings":[[0,[[9,1]]]],"term":"does"},{"idf":0,"postings":[[3,[[9,1]]]],"term":"downloads"},{"idf":0,"postings":[[3,[[1,2],[2,1],[9,2]]]],"term":"e2"},{"idf":0,"postings":[[3,[[0,1],[1,1],[4,1]]]],"term":"e2e"},{"idf":0,"postings":[[2,[[3,1],[9,1]]]],"term":"e403"},{"idf":0,"postings":[[1,[[9,1]]]],"term":"each"},{"idf":0,"postings":[[2,[[2,1],[3,1],[9,1]]]],"term":"enabled"},{"idf":0,"postings":[[1,[[9,1]]]],"term":"endpoint"},{"idf":0,"postings":[[3,[[3,1]]]],"term":"enoent"},{"idf":0,"postings":[[3,[[2,1],[3,1],[9,1]]]],"term":"enotcached"},{"idf":0,"postings":[[0,[[9,1]]]],"term":"enough"},{"idf":0,"postings":[[2,[[9,1]]]],"term":"errors"},{"idf":1,"postings":[[1,[[9,1]]],[3,[[9,1]]]],"term":"ever"},{"idf":2,"postings":[[0,[[9,2]]],[1,[[9,2]]],[2,[[9,1]]],[3,[[9,1]]]],"term":"every"},{"idf":0,"postings":[[0,[[9,1]]]],"term":"exceeds"},{"idf":0,"postings":[[3,[[9,1]]]],"term":"execpath"},{"idf":0,"postings":[[3,[[9,1]]]],"term":"execute"},{"idf":0,"postings":[[0,[[9,1]]]],"term":"exists"},{"idf":0,"postings":[[3,[[3,1]]]],"term":"exited"},{"idf":0,"postings":[[2,[[9,1]]]],"term":"explicitly"},{"idf":0,"postings":[[2,[[1,2],[2,1],[9,3]]]],"term":"fa"},{"idf":0,"postings":[[2,[[1,2],[2,1]]]],"term":"fa/otp"},{"idf":1,"postings":[[0,[[1,2],[2,1],[3,1],[9,3]]],[2,[[3,1]]]],"term":"factor"},{"idf":0,"postings":[[0,[[2,1]]]],"term":"fail"},{"idf":0,"postings":[[0,[[3,1],[9,1]]]],"term":"failed"},{"idf":1,"postings":[[0,[[1,2],[9,1]]],[3,[[3,1]]]],"term":"fails"},{"idf":0,"postings":[[3,[[9,1]]]],"term":"fallbacks"},{"idf":0,"postings":[[2,[[1,2],[2,1],[9,2]]]],"term":"false"},{"idf":0,"postings":[[0,[[9,1]]]],"term":"far"},{"idf":1,"postings":[[1,[[3,1],[9,1]]],[3,[[9,1]]]],"term":"fetches"},{"idf":0,"postings":[[1,[[9,1]]]],"term":"field"},{"idf":1,"postings":[[0,[[9,1]]],[3,[[9,1]]]],"term":"first"},{"idf":0,"postings":[[0,[[9,1]]]],"term":"fixed"},{"idf":0,"postings":[[3,[[0,1],[1,3],[2,1],[4,1],[9,3]]]],"term":"fixture"},{"idf":0,"postings":[[3,[[1,2],[2,1],[9,1]]]],"term":"fixture-owned"},{"idf":0,"postings":[[2,[[9,2]]]],"term":"for"},{"idf":0,"postings":[[3,[[9,1]]]],"term":"fresh"},{"idf":1,"postings":[[1,[[3,1],[9,1]]],[3,[[9,3]]]],"term":"from"},{"idf":0,"postings":[[0,[[3,2],[5,1],[9,2]]]],"term":"gate"},{"idf":1,"postings":[[0,[[3,1]]],[2,[[1,2]]]],"term":"gates"},{"idf":1,"postings":[[1,[[9,1]]],[2,[[2,1],[9,1]]]],"term":"generated"},{"idf":1,"postings":[[1,[[9,1]]],[2,[[3,1]]]],"term":"generation"},{"idf":0,"postings":[[0,[[9,1]]]],"term":"genuine"},{"idf":0,"postings":[[0,[[9,1]]]],"term":"get"},{"idf":0,"postings":[[2,[[1,2],[2,1],[9,1]]]],"term":"git"},{"idf":1,"postings":[[0,[[9,2]]],[3,[[2,1],[9,1]]]],"term":"global"},{"idf":0,"postings":[[2,[[2,1],[3,1],[9,1]]]],"term":"granular"},{"idf":0,"postings":[[0,[[9,1]]]],"term":"green"},{"idf":0,"postings":[[1,[[9,1]]]],"term":"grep"},{"idf":0,"postings":[[0,[[9,2]]]],"term":"group"},{"idf":0,"postings":[[0,[[9,1]]]],"term":"groups"},{"idf":0,"postings":[[3,[[9,1]]]],"term":"had"},{"idf":0,"postings":[[0,[[2,1],[9,3]]]],"term":"hardware"},{"idf":0,"postings":[[3,[[9,1]]]],"term":"has"},{"idf":0,"postings":[[1,[[9,1]]]],"term":"hashes"},{"idf":0,"postings":[[3,[[2,1]]]],"term":"hides"},{"idf":0,"postings":[[1,[[1,2],[2,1],[3,1],[9,3]]]],"term":"host"},{"idf":0,"postings":[[2,[[3,1]]]],"term":"how"},{"idf":0,"postings":[[1,[[9,2]]]],"term":"https"},{"idf":0,"postings":[[2,[[1,2],[2,1],[9,1]]]],"term":"hub"},{"idf":0,"postings":[[1,[[9,1]]]],"term":"identical"},{"idf":3,"postings":[[0,[[9,1]]],